question	icon	category	priority	answer
Что такое CSA и как это связано с поставками натуральных продуктов?		0	0	CSA - это клуб, проект солидарного сельского хозяйства (Community Supported Agriculture), участниками которого являются с одной стороны городские жители (потребители продукции ферм), а с другой - фермеры. Потребители получаются экологически чистую продукцию напрямую с биодинамических ферм, минуя рынки и магазины. Участники клуба платят членские взносы, получая взамен еженедельные поставки продукции ферм. Также клуб проводит мероприятия (семинары, выезды на фермы и проч.), участие в которых активно поощряется.
Чем ваша продукция отличается от той, что представлена в магазинах?		0	0	Наша продукция отличается содержанием полезных веществ, свежестью и ассортиметном. В рыночной модели производства сельхозпродукции мерилом является масса продукта, при этом его содержание уходит на второй план и обычно не осознается потребителем. В нашей же модели производства во главу угла ставится содержание, то есть количество важных и полезных для организма веществ.
Почему вы предлагаете именно такой ассортимент?		0	0	У нас ассортимент не диктуется рынком, но определяется полезностью культур для физиологии человека в каждое время года.
Продается ли ваша продукция в магазинах?		0	0	Нет. В солидарном сельском хозяйстве продовольствие не распределяется через рынок, а делится напрямую между участниками клуба.
Что такое "биодинамическая ферма"?		0	0	Система биодинамики построена вокруг компостно-органического природного цикла и естественных минералов. Она учитывает природные циклы и использует растительные препараты, действующие на микробиологическом уровне. Все это не только усиливает жизненные процессы в почве, но и возвращает восприимчивость растений, вырванных из естественного цикла развития сельским хозяйством, обратно к природным циклам.
Как вы гарантируете то, что ваша продукция действительно натуральная и выращена именно на биодинамической ферме?		0	0	Фермеры работают по строгим планам, созданным и претворяемым в жизнь ведущими специалистами в области биодинамического сельского хозяйства. Мы осуществляем постоянный контроль и управление процессом ее культивации. Ммы организуем семинары и посещения участниками клуба ферм, где они могут задать свои вопросы фермерам и специалистам.
В магазинах тоже продается "фермерская" продукция. Чем ваша лучше?		0	0	Понятие "фермерская продукция" - довольно расплывчато. Наша продукция выращивается именно на биодинамических фермах, что резко отличает ее от другой "фермерской" продукции по качеству, полезности, отсутсвию каких бы то ни было вредных примесей.
Почему мы берем солидарные взносы?		0	0	Мы прикладываем максимум усилий для обеспечения доступности нашего рациона для семей с разным достатком. Несмотря на то, что производство биодинамических продуктов вообще и нашего ассортимента в частности дороже по себестоимости, мы достигаем доступности за счет грамотного распределения финансовой нагрузки. Производственный цикл начинается задолго до начала поставок и сборов долей урожая. Для этого необходимо сформировать кассу обеспечения уже до начала работ и закупки необходимых средств производства. Именно по этому солидарные взносы так важны для всего проекта. В не предвиденный случая например природные риски, солидарные взносы могут быть использованы для компенсации ущерба и стабилизации проекта.
Сколько стоит ваша продукция?		0	0	Подробную информацию см., пожалуйста, в разделе "<a href='/participation/'>Условия участия</a>".